"adopter_index","id","univ_name_cn","univ_name_en","policy_scope","tool_specified","linked_to_pass","implementation_class","implementation_language_coded","policy_summary_exact","source_url"
14,86,"西北农林科技大学","Northwest A&F University","",1,1,"Broad required detection framework","The university explicitly requires AIGC detection for graduation theses. All 2025 pre-graduates must participate in AIGC detection with one free quota, and the detection must be completed by May 20th.","II. Artificial Intelligence Generated Content (AIGC) Detection Subjects of Detection All 2025 graduating students will participate in AIGC detection, with each student receiving one free detection provided by their college. Detection must be completed by May 20. Detection Content The detection will identify whether the text partially or entirely exhibits characteristics of AI model generation, producing a detection report that includes the suspected proportion of AIGC content relative to the full text, the distribution of suspected AIGC fragments, and other relevant details. Application of Results The AIGC detection results will serve as a key reference for evaluating the grades of the 2025 undergraduate graduation theses (designs) and for selecting outstanding theses (designs). Students found to have violated regulations on AI tool usage will face appropriate penalties based on the severity of the offense, which may include but are not limited to disqualification from the defense, invalidation of thesis grades, and handling as cases of academic misconduct. Other Relevant Requirements (1) Supervising instructors must guide students in the proper use of AI tools, ensuring their usage is reasonable and compliant, and review their eligibility for defense. (2) Reviewing instructors must evaluate the thesis (design) and provide opinions on whether the student should proceed to the defense. (3) Defense panels must strengthen the examination and verification of core competencies and original contributions for theses (designs) suspected of improper AI tool usage. (4) Students bear ultimate responsibility for the content generated using AI tools, ensuring it complies with academic standards and quality requirements. AI tools must not be listed as authors or collaborators. (5) Students who violate AI tool usage regulations will face appropriate penalties based on the severity of the offense, including but not limited to disqualification from the defense, invalidation of thesis grades, and handling as cases of academic misconduct. Colleges and supervising instructors whose students are identified as having ""problematic theses"" due to AI tool usage in random inspections by the Ministry of Education will be dealt with according to relevant regulations. Before the 2025 undergraduate defense, the secretary of each group must collect the AIGC detection results signed by the supervising instructor as part of the defense materials.","https://cmee.nwsuaf.edu.cn/xwzx/xytz/52e119da18b34a6b8209c6aa20023ad2.htm"
15,87,"北京工业大学","Beijing University of Technology","",0,1,"Broad required detection framework","2. Academic Integrity All undergraduate graduation projects (theses) for the class of 2025 are required to undergo academic misconduct detection, which includes comparison against the CNKI (China National Knowledge Infrastructure) database, internal comparisons with theses from the current and previous years within the university, and AI-generated content (AIGC) detection. In principle, the permissible similarity ratio for science and engineering disciplines must not exceed 25%, while for other disciplines it must not exceed 30%. Projects (theses) failing to meet the required similarity ratio will not be eligible to proceed to the graduation project (thesis) defense stage. The direct use of AI-generated content for writing graduation projects (theses) is strictly prohibited. Any such practice, once identified and verified, will be classified as ghostwriting of a graduation project (thesis) and treated as academic misconduct, subject to disciplinary actions in accordance with the university's regulations. If students utilize AI writing tools for auxiliary purposes, it is recommended that they provide a clear statement detailing the usage in relevant sections of their graduation project (thesis), such as the references or acknowledgments.","2. Academic Integrity All undergraduate graduation projects (theses) for the class of 2025 are required to undergo academic misconduct detection, which includes comparison against the CNKI (China National Knowledge Infrastructure) database, internal comparisons with theses from the current and previous years within the university, and AI-generated content (AIGC) detection. In principle, the permissible similarity ratio for science and engineering disciplines must not exceed 25%, while for other disciplines it must not exceed 30%. Projects (theses) failing to meet the required similarity ratio will not be eligible to proceed to the graduation project (thesis) defense stage. The direct use of AI-generated content for writing graduation projects (theses) is strictly prohibited. Any such practice, once identified and verified, will be classified as ghostwriting of a graduation project (thesis) and treated as academic misconduct, subject to disciplinary actions in accordance with the university's regulations. If students utilize AI writing tools for auxiliary purposes, it is recommended that they provide a clear statement detailing the usage in relevant sections of their graduation project (thesis), such as the references or acknowledgments.","https://undergrad.bjut.edu.cn/info/1216/3215.htm"
16,91,"中国地质大学（北京）","China University of Geosciences, Beijing","",0,0,"Broad required detection framework","The university explicitly requires AIGC detection for graduation theses. All 2025 undergraduate graduation theses must participate in academic misconduct detection, which includes AIGC detection as a mandatory item.","I. Function Overview (1) AI Intelligent Evaluation: Provides in-depth analysis of thesis content, identifying core issues and offering recommendations. The evaluation covers political alignment, relevance to professional training objectives, consistency between title and content, structural completeness, as well as key research elements such as research content, methodology, and conclusions. Evaluation results are categorized into four levels: A (Excellent Thesis), B (Qualified Thesis), C (Revision Recommended), D (High-Risk Thesis). Students may revise their theses based on the AI evaluation suggestions, while supervisors may use these insights to provide further guidance. (2) AIGC Detection: Effectively identifies and guides teachers and students in the appropriate use of AI-generated content. The system generates an AIGC detection rate to prevent misuse of AI and enhance thesis quality. (3) Trial Usage Disclaimer: The content generated by the AI Intelligent Evaluation system in this pilot phase is intended solely as reference material for revising undergraduate graduation projects (theses). It does not influence grade assessment. The final quality of the graduation project (thesis) shall be determined and verified by the supervising instructor.","https://jwc.cugb.edu.cn/c/2025-05-14/826040.shtml"
17,96,"福州大学","Fuzhou University","",0,1,"Broad required detection framework","The university explicitly requires AIGC detection for graduation theses. The university will conduct AIGC detection on both the final draft before defense and the final draft after defense of all 2025 undergraduate graduation theses, with clear detection objects and implementation procedures, forming a formal mandatory AIGC detection requirement.","(6) Plagiarism Check and AIGC Detection for Graduation Projects (Theses) In order to further strengthen the quality supervision and management of graduation projects (theses), encourage academic innovation, uphold academic integrity, ensure the quality of undergraduate graduation projects (theses), regulate the scientific and reasonable use of AIGC technology by students, and prevent academic misconduct such as plagiarism, AI-assisted ghostwriting, falsification, and improper citation during the writing process, the university will conduct plagiarism checks and AIGC detection on the final drafts (pre-defense) and post-defense versions of the 2025 undergraduate graduation projects (theses). These measures are implemented in accordance with the Academic Degrees Law of the People’s Republic of China (Presidential Decree No. 22) and the Measures for Handling Academic Misconduct in Degree Theses (Ministry of Education Decree No. 34). 1. Subjects of Detection All graduation projects (theses) of the 2025 undergraduate cohort. 2. Detection Standards Colleges should further educate students on academic integrity, require them to sign the Fuzhou University Undergraduate Graduation Project (Thesis) Integrity Commitment Form, and clearly inform students of the following university-established thesis detection standards and handling measures: (1) The comparison scope for students’ graduation projects (theses) includes the default database of the VIPS (Weipu) plagiarism detection system and all graduation projects (theses) of the current cohort. (2) The university stipulates the following detection standards for undergraduate graduation projects (theses): The similarity ratio after removing the student’s own previously published work should be ≤20%. The AIGC full-text detection value should be ≤20%. Colleges may establish stricter detection standards based on disciplinary characteristics and graduation project (thesis) requirements. These standards must be communicated to students before the start of the graduation project (thesis) work and submitted to the Academic Affairs Office for record-keeping. Students’ graduation projects (theses) must meet the college’s detection standards to be eligible for defense. (3) The plagiarism check files (pre-defense and post-defense versions) for undergraduate graduation projects (theses) must be uploaded in PDF format. (4) For university-level outstanding graduation projects (theses), the detection results should meet the following criteria: The similarity ratio after removing the student’s own previously published work should be ≤15%. The AIGC full-text detection value should be ≤15%. If either the similarity ratio after removal or the AIGC full-text detection value exceeds 15%, the qualification for university-level outstanding evaluation will be revoked.","https://jzxy.fzu.edu.cn/info/1013/3232.htm"
18,99,"华南师范大学","South China Normal University","",0,1,"Pilot or sampled implementation","The university explicitly requires AIGC detection for undergraduate graduation theses, as it stipulates that AIGC detection will be piloted on the basis of duplicate check for 2025 undergraduate graduation theses, covering all 2025 undergraduates and implemented through the graduation project system.","III. Implementing Plagiarism Checks and Self-inspections for Undergraduate Theses All colleges shall supervise and guide the 2025 graduates to complete plagiarism checks for their undergraduate theses through the graduation project system. In principle, a text similarity rate (excluding the student's own publications) below 30% (exclusive) is required to qualify for the thesis defense. In addition to the plagiarism checks for undergraduate theses, the university will pilot an artificial intelligence-generated content detection system this year, which will serve as an important reference for thesis defense eligibility and grade assessment.","http://em.scnu.edu.cn/a/20250314/10543.html"
19,103,"东北财经大学","Dongbei University of Finance and Economics","",0,1,"Broad required detection framework","The university explicitly requires AIGC detection for undergraduate graduation theses, as it adds AIGC detection as a mandatory item for the current undergraduate thesis detection, and stipulates that all undergraduate graduation theses must participate in the detection (including AIGC detection).","IV. Assessment and Handling of Detection Results Procedures for Handling Detection Results: (1) If the detection result R ≤ 20%, it is deemed to have passed the detection, and the student is eligible for the defense. (2) If the final detection result R > 20%, it is deemed to have failed the detection, and the student is not eligible for the defense. (Note: R refers to the percentage of text similarity, calculated as the proportion of overlapping text between the submitted graduation thesis/design and non-original academic works relative to the full length of the thesis.) For graduation theses/designs with a final detection result R ≤ 20% that require a second defense, a re-detection must be conducted before the second defense. The thesis/design may proceed to the second defense only after passing the re-detection. The detection result for university-level outstanding graduation theses/designs must not exceed 10%. This round of detection includes an AIGC (Artificial Intelligence-Generated Content) detection component. If the AIGC detection result exceeds 40%, it is recommended that the thesis/design be revised. All undergraduate graduation theses/designs must undergo detection. Students unable to submit detection materials on time must submit a written explanation (see Attachment 2; please email the electronic version to songjia@surrey.ac.uk) at least five working days before the detection deadline. The explanation must be approved by the supervising instructor and the college, then submitted to the Academic Affairs Office for review. Students who fail to submit detection materials without valid reasons or do not participate in the detection on time will be disqualified from the graduation thesis defense for the current year.","https://surrey.dufe.edu.cn/content_91162.html"
20,104,"江苏大学","Jiangsu University","",1,1,"Framework present; requirement strength unclear","The university explicitly requires AIGC detection for undergraduate graduation theses, as it specifies 2 free detection opportunities per student, a clear passing threshold (AI-generated content ratio ≤ 40%), a standardized operation process via the graduation project management system, and penalty measures for non-compliance.","(II) AIGC (Artificial Intelligence Generated Content) Detection AIGC detection refers to the identification and verification of content generated by artificial intelligence. Number of Detections: The system provides each student with 2 detection opportunities. Detection Standards: The proportion of AI-generated content indicated by the AIGC detection results should, in principle, not exceed 40% (inclusive). Detection Process: After logging into the graduation project management system, click ""Process Management"" → ""Submit AIGC Detection"" → upload the thesis (detailed instructions are provided in Appendix 2). Both the college and the supervising instructor can view the detection results in the system. Note: If a student's AIGC detection results exceed the specified threshold during the defense, the college will submit the case to the defense panel for review. If academic misconduct is confirmed, penalties may include delayed defense, redoing the graduation project (thesis), or other measures as appropriate. In severe cases, the student's grade will be recorded as failing.","https://jwc.ujs.edu.cn/__local/4/ED/24/AA9B4251DB4F3F7C7456155F3BE_943364B4_2115F.pdf"
21,106,"华北电力大学","North China Electric Power University","",0,0,"Broad required detection framework","The university explicitly requires AIGC detection for graduate theses, as it will introduce an ""AIGC Detection Service System"" starting from 2024 to conduct mandatory detection on all graduate theses for degree applications.","Starting from 2024, our university will introduce the ""AIGC Detection Service System"" to screen all dissertation papers submitted by degree-seeking graduate students. All students are expected to conscientiously adhere to academic standards and resist any practices involving the use of artificial intelligence to ghostwrite academic papers.","https://yjsy.ncepu.edu.cn/tzgg/9f64c23df5914e53b821a413943280db.htm"
22,111,"重庆医科大学","Chongqing Medical University","",0,0,"Broad required detection framework","The university explicitly requires AIGC detection for graduation theses, as it adds ""AI ghostwriting"" to the academic integrity veto indicators and mandates that all 2025 full-time undergraduate graduation theses undergo AIGC detection with the thesis check system updated to include this function;","The second item under ""Disqualifying Indicators"" regarding academic integrity now includes ""including AI ghostwriting."" This year, the thesis plagiarism detection system has been updated with an AIGC detection function. All full-time undergraduate theses for the graduating class of 2025 will undergo AIGC detection, and the results will be provided to supervising instructors for reference.","https://jwc.cqmu.edu.cn/info/1007/3361.htm"
23,116,"南京林业大学","Nanjing Forestry University","",0,1,"Framework present; requirement strength unclear","The university explicitly requires AIGC detection for graduation theses, as it mandates AIGC detection for 2025 undergraduate graduation theses, specifies that the detection is conducted through the graduation thesis (design) system, defines the detection content (identifying AI-generated text features and generating detailed reports), and clarifies the requirement for students to revise the thesis based on detection results;","III. Detection Process (1) AIGC Detection and Format Checking AIGC detection is used to identify whether the text partially or entirely exhibits characteristics of being generated by artificial intelligence models. It produces a detection report containing metrics such as the suspected proportion of AIGC content relative to the full text and the distribution of suspected AIGC segments. Format checking is conducted to verify whether the thesis (design) complies with the Nanjing Forestry University Undergraduate Thesis (Design) Writing Standards and Formatting Guidelines (Attachment 1). Both AIGC detection and format checking are performed within the graduation thesis (design) system (specific operational procedures are detailed in Attachment 2). Under the guidance of their advisors, students are required to revise and improve their theses (designs) based on the results of the AIGC detection and format checks. The AIGC detection results will serve as an important reference for evaluating the grades of the 2025 undergraduate theses and for selecting outstanding theses.","http://jwc.njfu.edu.cn//sjjx/bysjlw/20250424/i338126.html"
24,118,"浙江师范大学","Zhejiang Normal University","",0,1,"Framework present; requirement strength unclear","The university explicitly requires AIGC detection for graduation theses, as it clearly stipulates that AIGC detection is a mandatory requirement for undergraduate graduation theses and sets a specific threshold for the detection result;","Students must submit the main body of their graduation project (thesis) within the specified timeframe. The similarity rate of the thesis must not exceed 20%, and the AIGC detection result must not exceed 30%.","https://smxy.zjnu.edu.cn/2025/0416/c17162a515544/page.htm"
25,119,"海南大学","Hainan University","",0,1,"Framework present; requirement strength unclear","The university explicitly requires AIGC detection for graduation theses, as it sets a clear quantitative standard for AIGC detection (full-text AIGC detection value ≤20%) and incorporates it into the unified detection requirements for graduation theses alongside the repetition rate;","If both the paper similarity rate and the AIGC full-text detection value are ≤20%, the thesis is deemed to have passed the detection.","https://jwc.hainanu.edu.cn/__local/1/04/AA/FD034AC1081D9280A636BC5666B_1D7E8AAB_1BE81.pdf"
26,120,"南京工业大学","Nanjing Tech University","",1,1,"Broad required detection framework","The university explicitly requires AIGC detection for graduation theses, as it mandates AIGC detection for all graduation theses in principle, specifies mandatory detection contents (main text, abstract, acknowledgment) and optional process materials, and allows colleges to formulate specific standards based on discipline characteristics;","II. AIGC Detection Requirements In principle, all graduation projects (theses) must undergo AIGC detection. The main body, abstract, and acknowledgments are mandatory components for detection. Supervising instructors may require the inclusion of process materials such as research proposals and foreign language translations within the detection scope. Each college may specify detailed AIGC detection criteria based on the characteristics of their respective disciplines and majors. These criteria shall be submitted to the Academic Affairs Office for filing before implementation. The AIGC detection results will serve as a reference for evaluating graduation project (thesis) grades and selecting outstanding undergraduate graduation projects (theses). For graduation projects (theses) with a significant proportion of suspected AI-generated content in the detection results, supervising instructors shall review and verify the findings, guiding and urging students to make revisions and undergo re-detection. Cases confirmed as academic misconduct will be subject to appropriate penalties, such as postponement of the defense or redoing the graduation project (thesis). In severe cases, graduation eligibility may be revoked, and the grade for the graduation project (thesis) will be recorded as failing.","https://jwc.njtech.edu.cn/info/1160/5987.htm"
27,121,"南京中医药大学","Nanjing University of Chinese Medicine","",0,1,"Framework present; requirement strength unclear","The university explicitly requires AIGC detection for graduation theses, as it sets a clear AIGC detection standard (full-text AI-generated content ratio ≤ 40%), formulates a complete process for exceeding the standard (warning, revision, re-inspection), and clarifies the authority for formulating professional standards and handling objections;","2. AIGC Standards The proportion of AI-generated content indicated in the AIGC detection results shall be ≤40%. If the AIGC detection result of a thesis exceeds 40%, the following procedures shall be implemented: (1) Warning and Reminder: The secondary college shall issue a warning to students whose AIGC detection results exceed the standard, alerting them to the high proportion of AI-generated content in their graduation thesis (design). The students shall be required to conduct self-inspection and correction under the guidance of their instructors and make necessary revisions to their graduation thesis (design). (2) Revision and Re-examination: After receiving the warning, students must carefully revise their graduation thesis (design) to reduce the proportion of AI-generated content. Upon completion of the revision, the updated graduation thesis (design) shall be resubmitted to the secondary college, which will organize a re-examination. (3) Optimization of Detection Requirements: Based on the reference standards for AIGC detection results, secondary colleges may establish discipline-specific standards that align with the characteristics of their respective majors and the actual conditions of the college. These standards shall be submitted to the Academic Affairs Office for review and approval before implementation. (4) Strengthening Academic Integrity Education: In cases where AIGC limits are exceeded, secondary colleges shall enhance academic integrity education, raise students’ awareness of academic norms and ethics, guide students to establish correct academic values, and prevent the occurrence of academic misconduct. If students or instructors raise objections to the detection results, the graduation thesis (design) leadership group of the secondary college shall organize experts for evaluation and issue a conclusion.","https://jwc.hlxy.edu.cn/info/1172/6323.htm"
28,122,"南京信息工程大学","Nanjing University of Information Science & Technology","",0,1,"Framework present; requirement strength unclear","The university explicitly requires AIGC detection for graduation theses, as it defines AIGC detection, sets a clear passing threshold (AI-generated content ratio< 40% in principle), clarifies the handling authority of detection results (college academic committees), and allows colleges to formulate more detailed requirements based on discipline characteristics;","(2) AIGC detection refers to the method of identifying and analyzing content generated by artificial intelligence. If the proportion of AI-generated content shown in the detection results is generally less than 40%, it is considered as passing the detection. If the AIGC detection results significantly exceed the standard, the college may, in accordance with relevant regulations, revoke the student’s qualification for defense and record the grade as failing. The university has established this reference standard for detection results by drawing on the practices of comparable domestic institutions and considering the specific circumstances of our university. Based on this, each college may propose more detailed requirements in light of the characteristics of their respective disciplines and practical conditions, which shall be submitted to the Academic Affairs Office for filing before implementation. The detection results shall be reviewed and handled by the academic committee of the respective college.","https://ycxy.nuist.edu.cn/2025/0106/c73a281139/pagem.htm"
